<?xml version="1.0" encoding="UTF-8"?>
<root xmlns:xsi="http://www.w3.org/2001/XMLSchema-instance" xsi:noNamespaceSchemaLocation="equipment.xsd">
    <magicitems>
        <magicitem name="Adamantine Armor" category="Armor (medium or heavy, but not hide)" probability="uncommon" attunement=""/>
        <magicitem name="Ammunition, +1" category="Weapon (any ammunition)" probability="uncommon" attunement=""/>
        <magicitem name="Ammunition, +2" category="Weapon (any ammunition)" probability="rare" attunement=""/>
        <magicitem name="Ammunition, +3" category="Weapon (any ammunition)" probability="very rare" attunement=""/>
        <magicitem name="Amulet of Health" category="Wondrous item" probability="rare" attunement="y"/>
        <magicitem name="Amulet of the Planes" category="Wondrous item" probability="very rare" attunement="y"/>
        <magicitem name="Animated Shield" category="Armor (shield)" probability="very rare" attunement="y"/>
        <magicitem name="Apparatus of the Crab" category="Wondrous item" probability="legendary" attunement=""/>
        <magicitem name="Armor, +1" category="Armor (light, medium, or heavy)" probability="rare" attunement=""/>
        <magicitem name="Armor, +2" category="Armor (light, medium, or heavy)" probability="very rare" attunement=""/>
        <magicitem name="Armor, +3" category="Armor (light, medium, or heavy)" probability="legendary" attunement=""/>
        <magicitem name="Armor of Invulnerability" category="Armor (plate)" probability="legendary" attunement="y"/>
        <magicitem name="Armor of Resistance" category="Armor (light, medium, or heavy)" probability="rare" attunement="y">
            <subcategory name="Acid" category="" probability="" attunement=""/>
            <subcategory name="Cold" category="" probability="" attunement=""/>
            <subcategory name="Fire" category="" probability="" attunement=""/>
            <subcategory name="Force" category="" probability="" attunement=""/>
            <subcategory name="Lightning" category="" probability="" attunement=""/>
            <subcategory name="Necrotic" category="" probability="" attunement=""/>
            <subcategory name="Poison" category="" probability="" attunement=""/>
            <subcategory name="Psychic" category="" probability="" attunement=""/>
            <subcategory name="Radiant" category="" probability="" attunement=""/>
            <subcategory name="Thunder" category="" probability="" attunement=""/>
        </magicitem>
        <magicitem name="Armor of Vulnerability" category="Armor (plate)" probability="rare" attunement="y"/>
        <magicitem name="Arrow-Catching Shield" category="Armor (shield)" probability="rare" attunement="y"/>
        <magicitem name="Arrow of Slaying" category="Weapon (arrow)" probability="very rare" attunement=""/>
        <magicitem name="Bag of Beans" category="Wondrous item" probability="rare" attunement=""/>
        <magicitem name="Bag of Devouring" category="Wondrous item" probability="very rare" attunement=""/>
        <magicitem name="Bag of Holding" category="Wondrous item" probability="uncommon" attunement=""/>
        <magicitem name="Bag of Tricks" category="Wondrous item" probability="uncommon" attunement="">
            <subcategory name="Gray Bag of Tricks" category="" probability="" attunement=""/>
            <subcategory name="Rust Bag of Tricks" category="" probability="" attunement=""/>
            <subcategory name="Tan Bag of Tricks" category="" probability="" attunement=""/>
        </magicitem>
        <magicitem name="Bead of Force" category="Wondrous item" probability="rare" attunement=""/>
        <magicitem name="Belt of Dwarvenkind" category="Wondrous item" probability="rare" attunement="y"/>
        <magicitem name="Belt of Giant Strength" category="Wondrous item" probability="" attunement="y">
            <subcategory name="Hill giant" category="" probability="rare" attunement=""/>
            <subcategory name="Stone giant" category="" probability="very rare" attunement=""/>
            <subcategory name="Frost giant" category="" probability="very rare" attunement=""/>
            <subcategory name="Fire giant" category="" probability="very rare" attunement=""/>
            <subcategory name="Cloud giant" category="" probability="legendary" attunement=""/>
            <subcategory name="Storm giant" category="" probability="legendary" attunement=""/>
        </magicitem>
        <magicitem name="Berserker Axe" category="Weapon (any axe)" probability="rare" attunement="y"/>
        <magicitem name="Boots of Elvenkind" category="Wondrous item" probability="uncommon" attunement=""/>
        <magicitem name="Boots of Levitation" category="Wondrous item" probability="rare" attunement="y"/>
        <magicitem name="Boots of Speed" category="Wondrous item" probability="rare" attunement="y"/>
        <magicitem name="Boots of Striding and Springing" category="Wondrous item" probability="uncommon" attunement="y"/>
        <magicitem name="Boots of the Winterlands" category="Wondrous item" probability="uncommon" attunement="y"/>
        <magicitem name="Bowl of Commanding Water Elementals" category="Wondrous item" probability="rare" attunement=""/>
        <magicitem name="Bracers of Archery" category="Wondrous item" probability="uncommon" attunement="y"/>
        <magicitem name="Bracers of Defense" category="Wondrous item" probability="rare" attunement="y"/>
        <magicitem name="Brazier of Commanding Fire Elementals" category="Wondrous item" probability="rare" attunement=""/>
        <magicitem name="Brooch of Shielding" category="Wondrous item" probability="uncommon" attunement="y"/>
        <magicitem name="Broom of Flying" category="Wondrous item" probability="uncommon" attunement=""/>
        <magicitem name="Candle of Invocation" category="Wondrous item" probability="very rare" attunement="y">
            <subcategory name="Chaotic evil" category="" probability="" attunement=""/>
            <subcategory name="Chaotic neutral" category="" probability="" attunement=""/>
            <subcategory name="Chaotic good" category="" probability="" attunement=""/>
            <subcategory name="Neutral evil" category="" probability="" attunement=""/>
            <subcategory name="Neutral" category="" probability="" attunement=""/>
            <subcategory name="Neutral good" category="" probability="" attunement=""/>
            <subcategory name="Lawful evil" category="" probability="" attunement=""/>
            <subcategory name="Lawful neutral" category="" probability="" attunement=""/>
            <subcategory name="Lawful good" category="" probability="" attunement=""/>
        </magicitem>
        <magicitem name="Cape of the Mountebank" category="Wondrous item" probability="rare" attunement=""/>
        <magicitem name="Carpet of Flying" category="Wondrous item" probability="very rare" attunement="">
            <subcategory name="3ft. x 5 ft." category="" probability="" attunement=""/>
            <subcategory name="4ft. x 6ft." category="" probability="" attunement=""/>
            <subcategory name="5ft. x 7 ft." category="" probability="" attunement=""/>
            <subcategory name="6ft. x 9 ft." category="" probability="" attunement=""/>
        </magicitem>
        <magicitem name="Censer of Controlling Air Elementals" category="Wondrous item" probability="rare" attunement=""/>
        <magicitem name="Censer of Controlling Earth Elementals" category="Wondrous item" probability="rare" attunement=""/>
        <magicitem name="Censer of Controlling Fire Elementals" category="Wondrous item" probability="rare" attunement=""/>
        <magicitem name="Censer of Controlling Water Elementals" category="Wondrous item" probability="rare" attunement=""/>
        <magicitem name="Chime of Opening" category="Wondrous item" probability="rare" attunement=""/>
        <magicitem name="Circlet of Blasting" category="Wondrous item" probability="uncommon" attunement=""/>
        <magicitem name="Cloak of Arachnida" category="Wondrous item" probability="very rare" attunement="y"/>
        <magicitem name="Cloak of Displacement" category="Wondrous item" probability="rare" attunement="y"/>
        <magicitem name="Cloak of Elvenkind" category="Wondrous item" probability="uncommon" attunement="y"/>
        <magicitem name="Cloak of Protection" category="Wondrous item" probability="uncommon" attunement="y"/>
        <magicitem name="Cloak of the Bat" category="Wondrous item" probability="rare" attunement="y"/>
        <magicitem name="Cloak of the Manta Ray" category="Wondrous item" probability="uncommon" attunement=""/>
        <magicitem name="Crystal Ball" category="Wondrous item" probability="very rare" attunement="y"/>
        <magicitem name="Crystal Ball of Mind Reading" category="Wondrous item" probability="legendary" attunement="y"/>
        <magicitem name="Crystal Ball of Telepathy" category="Wondrous item" probability="legendary" attunement="y"/>
        <magicitem name="Crystal Ball of True Seeing" category="Wondrous item" probability="legendary" attunement="y"/>
        <magicitem name="Cube of Force" category="Wondrous item" probability="rare" attunement="y"/>
        <magicitem name="Cubic Gate" category="Wondrous item" probability="legendary" attunement=""/>
        <magicitem name="Dagger of Venom" category="Weapon (dagger)" probability="rare" attunement=""/>
        <magicitem name="Dancing Sword" category="Weapon (any sword)" probability="very rare" attunement="y"/>
        <magicitem name="Decanter of Endless Water" category="Wondrous item" probability="uncommon" attunement=""/>
        <magicitem name="Deck of Illusions" category="Wondrous item" probability="uncommon" attunement=""/>
        <magicitem name="Deck of many things" category="Wondrous item" probability="legendary" attunement=""/>
        <magicitem name="Defender" category="Weapon (any sword)" probability="legendary" attunement="y"/>